{
  "schema_version": "1.0.0",
  "conference": {
    "name": "EuroRust 2026",
    "timezone": "Europe/Madrid",
    "source_url": "https://eurorust.eu/",
    "schedule_url": "https://eurorust.eu/schedule/",
    "starts_at": "2026-10-14T10:00:00+02:00",
    "ends_at": "2026-10-17T16:00:00+02:00"
  },
  "sessions": [
    {
      "id": "workshops-beyond-p99-observing-async-rust",
      "title": "Beyond p99: Observing Async Rust",
      "official_url": "https://eurorust.eu/workshops/beyond-p99-observing-async-rust/",
      "kind": "workshop",
      "slot": {
        "start": "2026-10-14T10:00:00+02:00",
        "end": "2026-10-14T16:00:00+02:00"
      },
      "stage": "Workshop",
      "speaker_ids": [
        "speaker-juli-n-montes-de-oca-a60f5276"
      ],
      "venue_id": "workshops",
      "source": {
        "source_url": "https://eurorust.eu/schedule/",
        "retrieved_at": "2026-10-14T14:50:15.013173793+00:00",
        "source_updated_at": null,
        "content_sha256": "baa88200e12578c94fb1253ff1f06113d2cdb979b1d75e2cf04c2940dedb3de2"
      },
      "registration_url": "https://www.tickettailor.com/events/eurorust/2022388",
      "ticket_requirement": null,
      "remote_access": null,
      "recording_url": null,
      "detail_source": {
        "source_url": "https://eurorust.eu/workshops/beyond-p99-observing-async-rust/",
        "retrieved_at": "2026-10-14T14:50:15.816144710+00:00",
        "source_updated_at": null,
        "content_sha256": "a451c3737f647f5248ca15121e75fc1f8fde55e3ae416aa43aee0f7fd261a131"
      },
      "annotation": {
        "session_id": "workshops-beyond-p99-observing-async-rust",
        "summary": "Instrument async workloads to understand task progress, scheduling delays, slow requests, and the cost of production diagnostics.",
        "topics": [
          "observability",
          "async",
          "production-reliability"
        ],
        "prerequisites": "Comfort with Rust, preferably including some async programming; the named tools need no prior experience.",
        "setup": "Bring a Rust-ready laptop and follow the emailed preparation instructions.",
        "author": "Codex-assisted initial repository curation",
        "method": "Original paraphrase and topic interpretation after reading the official page; human community review remains open",
        "review_status": "source_checked_draft",
        "source_checked_at": "2026-10-14T14:17:14.395238+00:00",
        "source_content_sha256": "a451c3737f647f5248ca15121e75fc1f8fde55e3ae416aa43aee0f7fd261a131",
        "source_url": "https://eurorust.eu/workshops/beyond-p99-observing-async-rust/"
      }
    },
    {
      "id": "workshops-building-a-virtual-machine-monitor-in-rust",
      "title": "Building a virtual machine monitor in Rust",
      "official_url": "https://eurorust.eu/workshops/building-a-virtual-machine-monitor-in-rust/",
      "kind": "workshop",
      "slot": {
        "start": "2026-10-14T10:00:00+02:00",
        "end": "2026-10-14T16:00:00+02:00"
      },
      "stage": "Workshop",
      "speaker_ids": [
        "speaker-johan-sannemo-951eac7a"
      ],
      "venue_id": "workshops",
      "source": {
        "source_url": "https://eurorust.eu/schedule/",
        "retrieved_at": "2026-10-14T14:50:15.013173793+00:00",
        "source_updated_at": null,
        "content_sha256": "baa88200e12578c94fb1253ff1f06113d2cdb979b1d75e2cf04c2940dedb3de2"
      },
      "registration_url": "https://www.tickettailor.com/events/eurorust/2022388",
      "ticket_requirement": null,
      "remote_access": null,
      "recording_url": null,
      "detail_source": {
        "source_url": "https://eurorust.eu/workshops/building-a-virtual-machine-monitor-in-rust/",
        "retrieved_at": "2026-10-14T14:50:16.698550585+00:00",
        "source_updated_at": null,
        "content_sha256": "68f0bbfebd1c96ba1f5e45bca266f589c43f35a2de97b923e01e44eb6b6d0d55"
      },
      "annotation": {
        "session_id": "workshops-building-a-virtual-machine-monitor-in-rust",
        "summary": "Build a Linux-booting virtual-machine monitor while learning virtualization hardware, KVM interfaces, and device behavior.",
        "topics": [
          "infrastructure",
          "systems",
          "production-reliability"
        ],
        "prerequisites": "Comfort writing Rust; virtualization background is not required.",
        "setup": "Bring a laptop with an SSH client; the organizer describes provided cloud instances with nested virtualization.",
        "author": "Codex-assisted initial repository curation",
        "method": "Original paraphrase and topic interpretation after reading the official page; human community review remains open",
        "review_status": "source_checked_draft",
        "source_checked_at": "2026-10-14T14:17:15.378733+00:00",
        "source_content_sha256": "68f0bbfebd1c96ba1f5e45bca266f589c43f35a2de97b923e01e44eb6b6d0d55",
        "source_url": "https://eurorust.eu/workshops/building-a-virtual-machine-monitor-in-rust/"
      }
    },
    {
      "id": "workshops-c-to-rust",
      "title": "C→Rust, Beyond the Basics",
      "official_url": "https://eurorust.eu/workshops/c-to-rust/",
      "kind": "workshop",
      "slot": {
        "start": "2026-10-14T10:00:00+02:00",
        "end": "2026-10-14T16:00:00+02:00"
      },
      "stage": "Workshop",
      "speaker_ids": [
        "speaker-magnus-markling-56ebb7b6"
      ],
      "venue_id": "workshops",
      "source": {
        "source_url": "https://eurorust.eu/schedule/",
        "retrieved_at": "2026-10-14T14:50:15.013173793+00:00",
        "source_updated_at": null,
        "content_sha256": "baa88200e12578c94fb1253ff1f06113d2cdb979b1d75e2cf04c2940dedb3de2"
      },
      "registration_url": "https://www.tickettailor.com/events/eurorust/2022388",
      "ticket_requirement": null,
      "remote_access": null,
      "recording_url": null,
      "detail_source": {
        "source_url": "https://eurorust.eu/workshops/c-to-rust/",
        "retrieved_at": "2026-10-14T14:50:17.849088438+00:00",
        "source_updated_at": null,
        "content_sha256": "bd768b937bb3b014acf78424ac3c02d5afb8ff46305f3a2f2cc9bd4eb504ef5c"
      },
      "annotation": {
        "session_id": "workshops-c-to-rust",
        "summary": "Practice incremental C-to-Rust migration through interfaces, module replacement, and interoperability pitfalls.",
        "topics": [
          "interop",
          "systems",
          "production-reliability"
        ],
        "prerequisites": null,
        "setup": "Bring a laptop and follow the emailed software setup instructions.",
        "author": "Codex-assisted initial repository curation",
        "method": "Original paraphrase and topic interpretation after reading the official page; human community review remains open",
        "review_status": "source_checked_draft",
        "source_checked_at": "2026-10-14T14:17:16.381211+00:00",
        "source_content_sha256": "bd768b937bb3b014acf78424ac3c02d5afb8ff46305f3a2f2cc9bd4eb504ef5c",
        "source_url": "https://eurorust.eu/workshops/c-to-rust/"
      }
    },
    {
      "id": "workshops-containers-are-dead",
      "title": "Containers Are Dead: Long Live WebAssembly",
      "official_url": "https://eurorust.eu/workshops/containers-are-dead/",
      "kind": "workshop",
      "slot": {
        "start": "2026-10-14T10:00:00+02:00",
        "end": "2026-10-14T16:00:00+02:00"
      },
      "stage": "Workshop",
      "speaker_ids": [
        "speaker-jonas-kruckenberg-ef661ef6"
      ],
      "venue_id": "workshops",
      "source": {
        "source_url": "https://eurorust.eu/schedule/",
        "retrieved_at": "2026-10-14T14:50:15.013173793+00:00",
        "source_updated_at": null,
        "content_sha256": "baa88200e12578c94fb1253ff1f06113d2cdb979b1d75e2cf04c2940dedb3de2"
      },
      "registration_url": "https://www.tickettailor.com/events/eurorust/2022388",
      "ticket_requirement": null,
      "remote_access": null,
      "recording_url": null,
      "detail_source": {
        "source_url": "https://eurorust.eu/workshops/containers-are-dead/",
        "retrieved_at": "2026-10-14T14:50:18.851393307+00:00",
        "source_updated_at": null,
        "content_sha256": "c2fe35403e2a1002731367b974e1c9daccc0e3bb355dd240939a041badad4ac3"
      },
      "annotation": {
        "session_id": "workshops-containers-are-dead",
        "summary": "Build a Rust WebAssembly service and compare its deployment and isolation tradeoffs with container-based approaches.",
        "topics": [
          "infrastructure",
          "security",
          "systems"
        ],
        "prerequisites": "Rust familiarity and introductory awareness of WebAssembly.",
        "setup": "Confirm the organizer’s preparation instructions; specific equipment requirements are not captured here.",
        "author": "Codex-assisted initial repository curation",
        "method": "Original paraphrase and topic interpretation after reading the official page; human community review remains open",
        "review_status": "source_checked_draft",
        "source_checked_at": "2026-10-14T14:17:17.382260+00:00",
        "source_content_sha256": "c2fe35403e2a1002731367b974e1c9daccc0e3bb355dd240939a041badad4ac3",
        "source_url": "https://eurorust.eu/workshops/containers-are-dead/"
      }
    },
    {
      "id": "workshops-hands-on-embedded-rust",
      "title": "Hands-On Embedded Rust",
      "official_url": "https://eurorust.eu/workshops/hands-on-embedded-rust/",
      "kind": "workshop",
      "slot": {
        "start": "2026-10-14T10:00:00+02:00",
        "end": "2026-10-14T16:00:00+02:00"
      },
      "stage": "Workshop",
      "speaker_ids": [
        "speaker-domenic-quirl-ffc9c850",
        "speaker-bj-rn-barwinski-77b0809c"
      ],
      "venue_id": "workshops",
      "source": {
        "source_url": "https://eurorust.eu/schedule/",
        "retrieved_at": "2026-10-14T14:50:15.013173793+00:00",